{
  "event_id": "11111111-1111-4111-8111-111111111111",
  "event_type": "streams.device.connected",
  "timestamp": "2026-05-30T10:30:00Z",
  "payload": {
    "store_id": "a1a1a1a1-1111-4111-8111-111111111111",
    "device_id": "b2b2b2b2-2222-4222-8222-222222222222",
    "occurred_at": "2026-05-30T10:29:58Z"
  }
}
